{
  "schema_version": "1.0.0",
  "receipt_id": "sha256:4987f3ca166d7a40c3447c2576e9ae55250f2732a0f38689ea3e2c0856b6d089",
  "repository_id": "repo:example/codex-governed-change",
  "candidate_id": "sha256:bbbbbbbbbbbbbbbbbbbbbbbbbbbbbbbbbbbbbbbbbbbbbbbbbbbbbbbbbbbbbbbb",
  "projection_version": "1.0.0",
  "profile": "STANDARD",
  "context_qualification_id": "sha256:a59c8ea5a2faa94784e3ed808cb189c9a78660ddc499bdb64ba20975e543ebda",
  "source_bundle_sha256": "sha256:31a5abd67aa0e80e4a6b219fec810ac31a480cdb6366af0688f4179c0de7f85e",
  "source_sha256": "sha256:31a5abd67aa0e80e4a6b219fec810ac31a480cdb6366af0688f4179c0de7f85e",
  "projection_sha256": "sha256:31e88f64374752ed0de7c30dc934989afe343bf7c969878a932d3941e8d3793f",
  "included_sources": [
    {"kind": "authority", "reference": "evidence/task-decision.json", "sha256": "sha256:eeeeeeeeeeeeeeeeeeeeeeeeeeeeeeeeeeeeeeeeeeeeeeeeeeeeeeeeeeeeeeee"},
    {"kind": "unknown", "reference": "evidence/unknowns.json", "sha256": "sha256:ffffffffffffffffffffffffffffffffffffffffffffffffffffffffffffffff"}
  ],
  "excluded_sources": [
    {"reference": "evidence/unchanged-large.log", "sha256": "sha256:1111111111111111111111111111111111111111111111111111111111111111", "reason": "available_by_retrieval"}
  ],
  "estimated_input_tokens": 12000,
  "actual_input_tokens": 0,
  "actual_output_tokens": 0,
  "cached_input_tokens": 0,
  "prompt_bytes": 42000,
  "evidence_bytes": 30000,
  "retrieval_expansions": [],
  "truncation_status": "NONE",
  "model": "gpt-5.6-sol",
  "reasoning_effort": "xhigh",
  "latency_ms": 0,
  "cost": "unavailable",
  "quality_metrics": {
    "critical_defect_recall": "not-yet-qualified",
    "false_passes": 0,
    "false_blocks": 0,
    "mutation_kill_rate": "not-yet-measured",
    "evidence_traceability": "complete-for-example",
    "unresolved_unknowns": 1
  },
  "created_at": "2026-08-26T10:00:00Z"
}
